{
  "$schema": "http://json-schema.org/draft-07/schema#",
  "$id": "https://bentrd.github.io/GambonanzaMods/registry/schema.json",
  "title": "Gambonanza mod registry entry",
  "description": "One file per mod under registry/mods/<id>.json. The registry never stores mod binaries - it stores a pointer to a GitHub repository, and the mod manager downloads the DLL from that repository's own GitHub release.",
  "type": "object",
  "additionalProperties": false,
  "required": ["id", "name", "author", "summary", "repo", "asset", "folder"],
  "properties": {
    "id": {
      "type": "string",
      "pattern": "^[a-z0-9][a-z0-9-]{1,38}[a-z0-9]$",
      "description": "Unique, permanent, lowercase id. Must match the file name."
    },
    "name": {
      "type": "string",
      "minLength": 2,
      "maxLength": 48,
      "description": "Display name shown in the mod manager."
    },
    "author": {
      "type": "string",
      "minLength": 1,
      "maxLength": 48,
      "description": "Who made it. Usually the GitHub username."
    },
    "summary": {
      "type": "string",
      "minLength": 8,
      "maxLength": 140,
      "description": "One line, shown on the mod card. No marketing, just what it does."
    },
    "description": {
      "type": "string",
      "maxLength": 4000,
      "description": "Optional longer text for the detail panel. Plain text or light markdown."
    },
    "repo": {
      "type": "string",
      "pattern": "^[A-Za-z0-9_.-]+/[A-Za-z0-9_.-]+$",
      "description": "GitHub repository holding the mod source AND its releases, as owner/name."
    },
    "asset": {
      "type": "string",
      "minLength": 3,
      "maxLength": 120,
      "description": "Release asset to download. Glob: '*' matches any run of characters (e.g. 'MyMod-*.zip'). Either a .zip containing mod.json + the DLL, or a bare .dll (then 'manifest' is required)."
    },
    "folder": {
      "type": "string",
      "pattern": "^[A-Za-z0-9][A-Za-z0-9 ._-]{0,47}$",
      "description": "Folder name created under the game's Mods/ directory."
    },
    "tagPattern": {
      "type": "string",
      "maxLength": 60,
      "description": "Optional glob restricting which release tags count as this mod's releases. Useful in monorepos, e.g. 'mymod-v*'."
    },
    "prerelease": {
      "type": "boolean",
      "description": "If true, GitHub pre-releases are considered too. Defaults to false."
    },
    "manifest": {
      "type": "object",
      "additionalProperties": false,
      "description": "Only for mods shipped as a bare .dll. The manager writes this out as mod.json next to the DLL.",
      "required": ["entry"],
      "properties": {
        "entry": {
          "type": "string",
          "description": "Fully-qualified IMod type, e.g. 'MyMod.Namespace.MyModMain'."
        },
        "dependencies": {
          "type": "array",
          "items": { "type": "string" },
          "description": "Mod ids that must load first."
        }
      }
    },
    "tags": {
      "type": "array",
      "maxItems": 5,
      "items": {
        "type": "string",
        "enum": [
          "gameplay",
          "gambits",
          "strains",
          "quality-of-life",
          "ui",
          "visual",
          "audio",
          "cheats",
          "library",
          "tools"
        ]
      }
    },
    "homepage": {
      "type": "string",
      "pattern": "^https://",
      "maxLength": 200,
      "description": "Optional link shown on the mod page. Defaults to the repo."
    },
    "icon": {
      "type": "string",
      "pattern": "^https://(raw\\.githubusercontent\\.com|github\\.com|user-images\\.githubusercontent\\.com)/",
      "maxLength": 300,
      "description": "Optional square PNG hosted on GitHub. Keep it small (<= 256x256)."
    },
    "gameVersion": {
      "type": "string",
      "maxLength": 40,
      "description": "Informational: the Gambonanza version this was built against."
    },
    "frameworkVersion": {
      "type": "string",
      "maxLength": 40,
      "description": "Informational: the GambonanzaMods framework version this needs."
    },
    "dependencies": {
      "type": "array",
      "maxItems": 8,
      "items": { "type": "string" },
      "description": "Registry ids of other mods this one needs. The manager installs them first."
    },
    "pending": {
      "type": "boolean",
      "description": "Set while the repo has no matching release yet. The manager shows the mod as 'not published yet' and CI does not fail on the missing asset. Remove it once you cut a release."
    },
    "gambits": {
      "type": "array",
      "maxItems": 24,
      "description": "Gambits this mod adds to the game, so the manager can show them as in-game-style cards. Mirror the values the mod passes to GambitBuilder; the description keeps the game's TextMeshPro markup (<color=X>, <br>, <i>, <sprite=N>) verbatim.",
      "items": {
        "type": "object",
        "additionalProperties": false,
        "required": ["name", "sprite"],
        "properties": {
          "id": {
            "type": "string",
            "maxLength": 40,
            "description": "The gambit's in-game id (GambitBuilder.Create(id)); used by console commands like 'give gambit <id>'."
          },
          "name": {
            "type": "string",
            "maxLength": 48,
            "description": "The in-game display name (WithName)."
          },
          "description": {
            "type": "string",
            "maxLength": 300,
            "description": "The in-game description with its game markup, verbatim (WithDescription)."
          },
          "rarity": {
            "type": "string",
            "enum": ["common", "rare", "epic", "legendary", "strain"],
            "description": "The game's Rarity enum value, lowercased (WithRarity)."
          },
          "price": {
            "type": "integer",
            "minimum": 0,
            "maximum": 99,
            "description": "Shop price (WithPrice)."
          },
          "sprite": {
            "type": "string",
            "pattern": "^https://raw\\.githubusercontent\\.com/",
            "maxLength": 300,
            "description": "The gambit's sprite PNG on raw.githubusercontent.com (the only image host the manager's CSP allows). Point it at the same PNG the mod ships."
          }
        }
      }
    },
    "strains": {
      "type": "array",
      "maxItems": 24,
      "description": "Strains this mod adds through the Strain Creation API (StrainApi), so the manager can list them. Mirror the values the mod passes to StrainBuilder; the description keeps the game's TextMeshPro markup verbatim.",
      "items": {
        "type": "object",
        "additionalProperties": false,
        "required": ["name"],
        "properties": {
          "id": {
            "type": "string",
            "pattern": "^[a-z0-9][a-z0-9_-]{0,39}$",
            "description": "The strain's id (StrainBuilder.Create(id)); what 'strain on <id>' takes in the console."
          },
          "name": {
            "type": "string",
            "maxLength": 48,
            "description": "The display name (WithName)."
          },
          "description": {
            "type": "string",
            "maxLength": 300,
            "description": "What the strain does, with its game markup, verbatim (WithDescription)."
          }
        }
      }
    },
    "submittedBy": {
      "type": "string",
      "maxLength": 48,
      "description": "GitHub username of whoever submitted the entry."
    },
    "addedAt": {
      "type": "string",
      "pattern": "^[0-9]{4}-[0-9]{2}-[0-9]{2}$"
    }
  }
}
