{
  "id": "fishing-net",
  "name": "Fishing Net's Gambit",
  "author": "Agent15",
  "summary": "When an enemy piece is trapped, skip the enemy's turn.",
  "description": "A rare trap-focused gambit: whenever an enemy piece gets trapped (hunter tiles included), the enemy's next turn is skipped, turning every trap into free tempo. Needs the Gambit Creation API, which installs automatically.",
  "repo": "Agent15/Gambit_PWR_PACK",
  "asset": "FishingNetsGambit.zip",
  "folder": "FishingNetsGambit",
  "tags": [
    "gameplay",
    "gambits"
  ],
  "dependencies": [
    "gambit-api"
  ],
  "frameworkVersion": ">=1.2.0",
  "gameVersion": ">=1.0",
  "submittedBy": "Agent15",
  "addedAt": "2026-08-13"
}
