{
  "id": "drunkard-gambit",
  "name": "Drunkard",
  "author": "Ben",
  "summary": "After capturing, the piece staggers to a random safe empty tile.",
  "description": "A Rare gambit for 6 coins. Every time one of your pieces captures, it doesn't stay to gloat: it staggers on to a uniformly random intact empty tile, anywhere on the board - but drunkard's luck holds, and it never stumbles onto a square an enemy threatens. It might wander deep behind enemy lines or wobble two squares sideways; it just won't fall into a capture doing it.\n\nTwo sober exceptions: a capture that triggers a promotion is left alone - drunk pawns sober up at the finish line - and if every intact empty tile is threatened, or the board has none at all, the piece simply stays put. The card only relocates, it never kills.",
  "repo": "ben-gambo/mods",
  "asset": "DrunkardGambit.zip",
  "folder": "DrunkardGambit",
  "homepage": "https://github.com/ben-gambo/mods/tree/main/DrunkardGambit",
  "tags": [
    "gameplay",
    "gambits"
  ],
  "dependencies": [
    "gambit-api"
  ],
  "frameworkVersion": ">=1.3.3",
  "gameVersion": ">=1.0",
  "gambits": [
    {
      "id": "drunkard",
      "name": "Drunkard's Gambit",
      "rarity": "rare",
      "price": 6,
      "description": "After <b>CAPTURING</b>, the piece staggers<br>to a <color=©>RANDOM</color> <color=∆>SAFE</color> empty tile.",
      "sprite": "https://raw.githubusercontent.com/ben-gambo/mods/main/DrunkardGambit/drunkard.png"
    }
  ],
  "submittedBy": "ben-gambo",
  "addedAt": "2026-08-26"
}
