{
  "id": "moon-gambit",
  "name": "Moon Gambit",
  "author": "Ben",
  "summary": "The Moon does nothing. Drag it onto the Sun and get the Eclipse Gambit.",
  "description": "Two legendary cards. The Moon Gambit (8 coins) has no effect whatsoever - the tooltip says all there is to say: 'Surely this does something... right?'. But drag it onto the vanilla Sun gambit in your tray (either direction works) and the two merge into the Eclipse Gambit, which is also how the Eclipse gets unlocked in your collection.\n\nThe Eclipse still contains the Sun - earning a KING turns a random blank tile golden - and the Moon crossing in front makes every golden tile behave like EVERY tile at once: your pieces landing there are gilded, blessed, protected, and phantom-copied into your reserve, while enemy pieces stepping onto the gold are trapped, hunter-style, with no visual warning. Selling the Eclipse reverts every golden tile on the spot.",
  "repo": "ben-gambo/mods",
  "asset": "MoonGambit.zip",
  "folder": "MoonGambit",
  "homepage": "https://github.com/ben-gambo/mods/tree/main/MoonGambit",
  "tags": [
    "gameplay",
    "gambits"
  ],
  "dependencies": [
    "gambit-api"
  ],
  "frameworkVersion": ">=1.5.0",
  "gameVersion": ">=1.0",
  "gambits": [
    {
      "id": "moon",
      "name": "Moon Gambit",
      "rarity": "legendary",
      "price": 8,
      "description": "Surely this does<br>something... <i>right?</i>",
      "sprite": "https://raw.githubusercontent.com/ben-gambo/mods/main/MoonGambit/moon.png"
    },
    {
      "id": "eclipse",
      "name": "Eclipse Gambit",
      "rarity": "legendary",
      "price": 12,
      "description": "Earning a <b>KING</b> turns a tile <color=*>GOLDEN</color>.<br><color=*>GOLDEN</color> tiles behave like <b>EVERY</b> tile.",
      "sprite": "https://raw.githubusercontent.com/ben-gambo/mods/main/MoonGambit/eclipse.png"
    }
  ],
  "submittedBy": "ben-gambo",
  "addedAt": "2026-08-25"
}
